ID	[ADD CALENDAR ID HERE]
CR242: Building Your Professional Persona	Thursday, October 3, 2019 4:00 PM	Thursday, October 3, 2019 5:00 PM	UTC-4	OCCC W308D	Audience Level: All | Track: CRA-W | Start Date: Thursday, October 3, 2019 | Start Time: 4:00 PM | End Time: 5:00 PM | Location: OCCC W308D | Speakers: Andrea Danyluk, Ayanna Howard	Social media, oh my! This session addresses the dos and don’ts of building a professional image. Topics will include web presence (personal pages and social media), social media postings, dissemination of technical contributions, and professional ethics.	N
SE606: Digital Transformation: Disrupt or Be Disrupted	Thursday, October 3, 2019 4:00 PM	Thursday, October 3, 2019 5:00 PM	UTC-4	OCCC W224A	Audience Level: Intermediate | Track: Software Engineering | Focus Area: Digital Transformation, DevOps, and Programming Languages | Start Date: Thursday, October 3, 2019 | Start Time: 4:00 PM | End Time: 5:00 PM | Location: OCCC W224A | Speakers: Rashmi Kumar, Aileen Allkins, Ethelda A. Makoid, Alyson Crafton, Jyoti Sarin	Today's competitive landscape require leading edge innovative companies to use the power of technology to reimagine their business processes, core capabilities, and customer engagements to drive customer satisfaction, revenue and profitability. Learn how to adapt in this ever-changing world and embrace the disruption as an opportunity for reinvention of your business or risk being disrupted.	N
DS627: AI Auto Part Demand Forecasting - How to Prevent Car (Part) Pile Ups	Thursday, October 3, 2019 4:15 PM	Thursday, October 3, 2019 4:45 PM	UTC-4	OCCC W314A	Audience Level: Intermediate | Track: Data Science | Focus Area: Data Analysis & Modeling | Start Date: Thursday, October 3, 2019 | Start Time: 4:15 PM | End Time: 4:45 PM | Location: OCCC W314A | Speakers: Brittany Bogle, Kristen McGarry	Spectra Premium Industries is a North American leader in automotive aftermarket parts engineering, manufacturing, and distribution. Products require highly accurate forecasting months in advance due to production/supply lead times. IBM and Spectra Premium collaboratively designed a hybrid machine learning approach to predict demand for over 1000 part numbers that outperforms their existing system.	N
HI648: Accessibility and Universal Design in PBS KIDS Digital Development	Thursday, October 3, 2019 4:15 PM	Thursday, October 3, 2019 4:45 PM	UTC-4	OCCC W304C	Audience Level: Intermediate | Track: Human Computer Interaction | Focus Area: Accessibility and Inclusive Design | Start Date: Thursday, October 3, 2019 | Start Time: 4:15 PM | End Time: 4:45 PM | Location: OCCC W304C | Speakers: Julie Maski, Jen Rodriguez	Join PBS KIDS Digital accessibility experts as they share the insights they've discovered in their mission to deliver content for the widest possible audience. Consider ways you can produce engaging, accessible, inclusive experiences, including which new technologies can be leveraged and how you can help everyone play and learn.	N
AZ539: Developers Do More than Code: An Engineer's Guide to Creating Amazing Experiences	Thursday, October 3, 2019 4:15 PM	Thursday, October 3, 2019 4:45 PM	UTC-4	OCCC W230C	Audience Level: Beginning | Track: Products A to Z | Focus Area: Product Excellence | Start Date: Thursday, October 3, 2019 | Start Time: 4:15 PM | End Time: 4:45 PM | Location: OCCC W230C | Speakers: Billie Sue Chafins	As a developer starting in the industry, you have the knowledge and tools to write code for almost anything. But have you stopped to consider how you'll directly impact the product or features customers use? In this talk, Hulu's Billie Sue Chafins will discuss how developers can have a direct impact on product development through the lens of shipping Hulu's Live Guide.	N
Reception Celebrating Black Women in Technical Roles	Thursday, October 3, 2019 4:30 PM	Thursday, October 3, 2019 6:00 PM	UTC-4	Hyatt Plaza International Ballroom D	Audience Level: All | Track: Lunches and Receptions | Start Date: Thursday, October 3, 2019 | Start Time: 4:30 PM | End Time: 6:00 PM | Location: Hyatt Plaza International Ballroom D	Promote and support black women technologists from industry, government, and academia. This reception event gives this community of women a chance to broaden their networks, connect with strong role models, and celebrate their accomplishments.	N
CR413: Driving 10x Scale: Amplifying Others Through Coaching	Thursday, October 3, 2019 4:30 PM	Thursday, October 3, 2019 5:30 PM	UTC-4	Hyatt Plaza International Ballroom G	Audience Level: Senior/Executive | Track: Career | Focus Area: Career Management Mastery | Start Date: Thursday, October 3, 2019 | Start Time: 4:30 PM | End Time: 5:30 PM | Location: Hyatt Plaza International Ballroom G | Speakers: Stephanie Szeto, Zainab Ghadiyali	Expand your leadership repertoire by learning how to effectively coach. Join us for this deep-dive to learn how to empower others to perform to their best potential and enable them tackle specific problems. You will leave with an understanding of how coaching fits into your broader leadership toolbox and how to facilitate effective coaching discussions.	N
CR220: Empower the Next Generation: Supporting K-12 Education as an Industry Professional	Thursday, October 3, 2019 4:30 PM	Thursday, October 3, 2019 5:00 PM	UTC-4	Hyatt Regency Ballroom S	Audience Level: Early Career | Track: Career | Focus Area: Inclusion and Cultural Awareness | Start Date: Thursday, October 3, 2019 | Start Time: 4:30 PM | End Time: 5:00 PM | Location: Hyatt Regency Ballroom S | Speakers: Amy Liu, Crystal Hsieh	In an increasingly technologically-driven world, there are not enough computer science teachers to educate the next generation. Teaching as an industry professional is not only feasible, it is a fulfilling, impactful opportunity that can transform your career. We propose that every female engineer can and should teach coding for K-12 students, and we provide resources for how to get involved.	N
Bill.com's Excellent Adventure into Machine Learning (Repeat)	Thursday, October 3, 2019 4:30 PM	Thursday, October 3, 2019 4:45 PM	UTC-4	Technology Showcase Theater, OCCC Expo Hall WB4	Start Date: Thursday, October 3, 2019 | Start Time: 4:30 PM | End Time: 4:45 PM | Location: Technology Showcase Theater, OCCC Expo Hall WB4	Learn how Bill.com is exploring Machine Learning to solve our customer’s greatest pain points. Join us for our adventure as we take you from running models for 20 hours on a single MacBook to leveraging AWS and from initial prediction accuracy rates that best equated to the shrug emoji to over 90% prediction accuracy. Featured Speaker: Chung Nguyen, Senior Software Engineer	N
AI614: The Story of Smart Compose: The Gmail Model That Loved Thanksgiving (Repeat)	Thursday, October 3, 2019 4:30 PM	Thursday, October 3, 2019 5:00 PM	UTC-4	OCCC W315B	Audience Level: Intermediate | Track: Artificial Intelligence | Focus Area: Humans and AI | Start Date: Thursday, October 3, 2019 | Start Time: 4:30 PM | End Time: 5:00 PM | Location: OCCC W315B | Speakers: Jackie Tsay, Matthew Dierker	Millions of emails are written each week in Gmail, and they all start with an empty box. Smart Compose introduced AI-powered suggestions to help users write. From fighting an ML model with a deep love for Thanksgiving to mitigating gender bias in suggestions, there are some interesting stories to tell. Join Smart Compose engineers to hear why a billion characters saved per week didn't come easily.	N
DS633: Applying NLP to Software Engineering: the Case of Classifying Security Bug Reports	Thursday, October 3, 2019 4:30 PM	Thursday, October 3, 2019 5:00 PM	UTC-4	OCCC W311F	Audience Level: Intermediate | Track: Data Science | Focus Area: Data Analysis & Modeling | Start Date: Thursday, October 3, 2019 | Start Time: 4:30 PM | End Time: 5:00 PM | Location: OCCC W311F | Speakers: Mayana Pereira	Identifying security bug reports (SBRs) is a vital step in the software development lifecycle. In supervised machine learning based approaches, it is usual to assume that entire bug reports are available for training and that their labels are noise free. We show that accurate label prediction is possible for SBRs even when solely the title is available and in presence of label noise.	N
CR310: Personal Branding - How to Stand Out and Be Unforgettable	Thursday, October 3, 2019 4:45 PM	Thursday, October 3, 2019 5:15 PM	UTC-4	Hyatt Regency Ballroom V	Audience Level: Mid-Career | Track: Career | Focus Area: Career Management Mastery | Start Date: Thursday, October 3, 2019 | Start Time: 4:45 PM | End Time: 5:15 PM | Location: Hyatt Regency Ballroom V | Speakers: Sheetal Wrzesien	Everyone has a personal brand - it's our reputation - how the world sees us. A strong brand can help advance careers, while a weak one can hold us back. How we market ourselves defines how others view our worth in the workplace and beyond. Great brands don't just happen. They take focus, planning and hard work. Learn how to build and leverage an effective brand to achieve professional success in tech.	N
CR229: Exerting Influence Without Authority	Thursday, October 3, 2019 4:45 PM	Thursday, October 3, 2019 5:15 PM	UTC-4	Hyatt Regency Ballroom O	Audience Level: Early Career | Track: Career | Focus Area: Career Management Mastery | Start Date: Thursday, October 3, 2019 | Start Time: 4:45 PM | End Time: 5:15 PM | Location: Hyatt Regency Ballroom O | Speakers: Aimee Cardwell	Have you struggled with getting people to do what you want when you have no authority over them? This feat seems nearly impossible. But there is hope! Not only is it possible, exerting influence without authority is one of the core skills of effective leadership. Learn how to use influence to go beyond mere compliance and gain enthusiastic cooperation from teams and individuals.	N
AI514: Building a Multi-domain Chatbot With Artificial Intelligence (Repeat)	Thursday, October 3, 2019 4:45 PM	Thursday, October 3, 2019 5:15 PM	UTC-4	OCCC W224D	Audience Level: Beginning | Track: Artificial Intelligence | Focus Area: Humans and AI | Start Date: Thursday, October 3, 2019 | Start Time: 4:45 PM | End Time: 5:15 PM | Location: OCCC W224D | Speakers: Xiaoqian Jin, Amy Eliason	At Travelers we wanted to design a chatbot that could reduce the conversation volume for our technical support center. To achieve this, we've built a multi-domain chatbot to integrate various chatbots within a single conversation. In this talk we will explain how we customized an open source chatbot framework with state-of-the-art AI models and unique features to build a multi-domain chatbot.	N
CR118: Women in Agile: The Sprint to Success	Thursday, October 3, 2019 4:45 PM	Thursday, October 3, 2019 5:15 PM	UTC-4	Hyatt Plaza International Ballroom H	Audience Level: All | Track: Career | Focus Area: Career Management Mastery | Start Date: Thursday, October 3, 2019 | Start Time: 4:45 PM | End Time: 5:15 PM | Location: Hyatt Plaza International Ballroom H | Speakers: Revekka Palaiologou, Yolanda He	Did you know research shows women have less confidence and fewer opportunities to fit into engineering culture and inside teams? Female engineers are used to feeling outnumbered, making it often feel like there aren't enough opportunities to grow and have impact. Come learn how Agile Development can help secure your seat at the table, find your motivation, and achieve career satisfaction.	N
CR216: Cracking the Internship Code: A Crash Course for Students Starting Out in Tech	Thursday, October 3, 2019 5:00 PM	Thursday, October 3, 2019 5:30 PM	UTC-4	Hyatt Orlando Ballroom L	Audience Level: Student | Track: Career | Focus Area: Career Management Mastery | Start Date: Thursday, October 3, 2019 | Start Time: 5:00 PM | End Time: 5:30 PM | Location: Hyatt Orlando Ballroom L | Speakers: Alejandro Davila	"Students are always told to ""get an internship"", but no one really shows them how. In this session, you'll learn how to set yourself up for success throughout your college career, how to find internships designed for early college students, and how to discover opportunities beyond big-name tech companies. You'll also learn valuable tips on applying and interviewing to find the best roles for you."	N
CS707: Edge Computing and Hybrid Cloud Solutions	Thursday, October 3, 2019 5:00 PM	Thursday, October 3, 2019 5:30 PM	UTC-4	OCCC W304G	Audience Level: Advanced | Track: Computer Systems Engineering | Focus Area: Tools and Techniques for Computing | Start Date: Thursday, October 3, 2019 | Start Time: 5:00 PM | End Time: 5:30 PM | Location: OCCC W304G | Speakers: Sumita Barahmand, Prathibha Chintagunta	The next wave of computing that powers modern digital transformation is Hybrid Computing, where applications can leverage computing, data services and resources wherever they are best suited based on what they need. This session focuses on how hybrid computing enables us to break beyond the limitations imposed by traditional IT solutions and public clouds to enable and accelerate innovation.	N
HI651: Accessibility Curricula Collaboration Fostering Employable Student Skills (MU ACCESS)	Thursday, October 3, 2019 5:00 PM	Thursday, October 3, 2019 5:30 PM	UTC-4	OCCC WF3	Audience Level: Intermediate | Track: Human Computer Interaction | Focus Area: Accessibility and Inclusive Design | Start Date: Thursday, October 3, 2019 | Start Time: 5:00 PM | End Time: 5:30 PM | Location: OCCC WF3 | Speakers: Tracy Christofero, Lori Howard	Industry is actively recruiting people who can create products everyone can use, but they cannot find trained talent due to a significant skills gap. MU ACCESS will help students obtain accessibility technical skills to fill that gap. SMART Device kits and an occupied SMART Dorm should excite students about innovative problem-solving, foster real-world connections and support future employability.	N
AZ660: Up for the Reliability Challenge: Scoping Reliability for IoT Products and Organizations	Thursday, October 3, 2019 5:00 PM	Thursday, October 3, 2019 5:30 PM	UTC-4	OCCC W222B	Audience Level: Intermediate | Track: Products A to Z | Focus Area: Product Excellence | Start Date: Thursday, October 3, 2019 | Start Time: 5:00 PM | End Time: 5:30 PM | Location: OCCC W222B | Speakers: Iyore Olaye	There are standardized models for hardware and software reliability independently, but no single model that governs reliability at the digital and physical convergence. How does a Product Manager approach scoping reliability systems specific for their product? This talk introduces best practices inspired by strategies Iyore developed as a Product leader at top e-scooter company Bird and e-commerce company Bevel (acq. Procter & Gamble).	N
SP667: Emerging Attacks on Mobile Applications	Thursday, October 3, 2019 5:00 PM	Thursday, October 3, 2019 5:30 PM	UTC-4	OCCC W415D	Audience Level: Intermediate | Track: Security/Privacy | Focus Area: Security Attacks and Defenses | Start Date: Thursday, October 3, 2019 | Start Time: 5:00 PM | End Time: 5:30 PM | Location: OCCC W415D | Speakers: Anusha Daka, Prathibha Muraleedhara	The exponential rise in use of mobile technologies is also providing new attack surface for cyber criminals. This presentation will cover emerging mobile threats, ways to detect them, and technical guidance to mitigate the underlying vulnerabilities.  It concludes by describing best practices for a sustainable mobile application security program.	N
TEF Reception	Thursday, October 3, 2019 5:00 PM	Thursday, October 3, 2019 6:30 PM	UTC-4	Hyatt Windermere Ballroom X	Start Date: Thursday, October 3, 2019 | Start Time: 5:00 PM | End Time: 6:30 PM | Location: Hyatt Windermere Ballroom X		N
Hoppers Lounge	Friday, October 4, 2019 8:00 AM	Friday, October 4, 2019 6:00 PM	UTC-4	OCCC W209C	Audience Level: Invite Only | Track: Lounge | Start Date: Friday, October 4, 2019 | Start Time: 8:00 AM | End Time: 6:00 PM | Location: OCCC W209C	The Hoppers Lounge is a room where Hoppers only can take breaks, and chat with other Hoppers.	N
SP576: Privacy Engineering for Everyone	Friday, October 4, 2019 9:00 AM	Friday, October 4, 2019 10:00 AM	UTC-4	OCCC W414A	Audience Level: Beginning | Track: Security/Privacy | Focus Area: Data Anonymization & Privacy | Start Date: Friday, October 4, 2019 | Start Time: 9:00 AM | End Time: 10:00 AM | Location: OCCC W414A | Speakers: Michele Guel, Lisa Bobbitt, Saran Morgan	The new General Data Privacy Regulation (GDPR) brought data privacy to the forefront in the last year.  Privacy engineering, as part of the overall product development lifecycle is paramount to ensuring compliance with the new regulations.  This workshop will present the basics of privacy engineering and demonstrate, through a privacy engineering exercises, that we all can be privacy engineers.	N
SE714: API Specification Driven Testing: Enabling Faster Releases with Higher Quality	Friday, October 4, 2019 9:00 AM	Friday, October 4, 2019 9:30 AM	UTC-4	OCCC W224A	Audience Level: Advanced | Track: Software Engineering | Focus Area: Continuous Integration, Agile Methodologies, Testing, and Automation | Start Date: Friday, October 4, 2019 | Start Time: 9:00 AM | End Time: 9:30 AM | Location: OCCC W224A | Speakers: Sivabalambikai Narayanaswamy	Does your team encounter issues like test scalability, maintainability and tests being out of sync with API Specification?  Spending a lot of time writing tests for different data combinations? Come learn about our new test strategy and a framework that has been developed, with the API specification being the driver and how it couples the potential of Behavioral Driven and Property based testing.	N
AI682: Start Your Engines! Reinforcement Learning with AWS DeepRacer	Friday, October 4, 2019 9:00 AM	Friday, October 4, 2019 10:00 AM	UTC-4	OCCC W415B	Audience Level: Intermediate | Track: Artificial Intelligence | Focus Area: Robots and Engineering | Start Date: Friday, October 4, 2019 | Start Time: 9:00 AM | End Time: 10:00 AM | Location: OCCC W415B | Speakers: Corey Salzer, Sahika Genc, Morgan Russell	Interested in getting hands-on experience with reinforcement learning as applied to autonomous driving? Participants will build and train machine learning models that they can then take to the track for a chance to climb the AWS DeepRacer League leaderboard. No prior machine learning experience is required â€“ just Python development knowledge and a thirst for fun and excitement!	N
Professional Development Leadership Workshop: Technical Storytelling and Influential Communication	Friday, October 4, 2019 9:00 AM	Friday, October 4, 2019 11:00 AM	UTC-4	Hyatt Windermere Z	Audience Level: All | Track: Special Session | Start Date: Friday, October 4, 2019 | Start Time: 9:00 AM | End Time: 11:00 AM | Location: Hyatt Windermere Z | Speakers: Poornima Vijayashanker, Karen Catlin	Tired of having your best ideas get shot down or subtly ignored? The best leaders are skilled communicators. One of their secrets is storytelling, even for technical presentations. They also confidently describe a strategic vision for the future to gain support. In this master class, you’ll learn to reframe ideas into strategic visions and build support through technical storytelling.	N
Speakers Corner	Friday, October 4, 2019 9:00 AM	Friday, October 4, 2019 2:00 PM	UTC-4	AnitaB.org Booth (631)	Start Date: Friday, October 4, 2019 | Start Time: 9:00 AM | End Time: 2:00 PM | Location: AnitaB.org Booth (631) | Speakers: Colleen Lewis, Pooja Sund, Margret Schmidt, Holly Liu, Marie Wieck, Nimmi Ramanujam, Thamar Solorio	Your Chance to Meet the Speakers! Stop by the AnitaB.org Booth #631 at the top of the hour to catch your favorite speakers in the Speakers Corner Theater. You’ll hear from ABIE Award winners, Keynote and Featured Speakers, and Academic and Tech Community Leaders in an intimate and informal setting. 9:10 a.m. – 9:50 a.m. – Managing Communication with Pooja Sund10:00 a.m.  – 10:45 a.m. – Transactions Transformed with Enterprise Blockchain with Marie Wieck, Suzanne Livingston, and Eileen Lowry 11:00 a.m. – 11:45 a.m. - Navigating “Style” Feedback with Margret Schmidt 12:00 p.m. – 12:45 p.m. - Abie Awards 15th Anniversary with Abie Award Winners Holly Liu, Thamar Solorio, and Nimmi Ramanujan 1:00 p.m. – 1:45 p.m. - Responding to Microaggressions with Colleen Lewis	N
CR110: Accept and Adapt  - Climbing the Corporate Ladder	Friday, October 4, 2019 9:00 AM	Friday, October 4, 2019 10:00 AM	UTC-4	Hyatt Plaza International Ballroom H	Audience Level: All | Track: Career | Focus Area: Inclusion and Cultural Awareness | Start Date: Friday, October 4, 2019 | Start Time: 9:00 AM | End Time: 10:00 AM | Location: Hyatt Plaza International Ballroom H | Speakers: Ani Dutta, Melissa Bachman, Kavita Ryali, Gilda Alvarez	One secret of success is failure! Great leaders turn setbacks into victories and obstacles into opportunities. Being able to accept and adapt can help one triumph over failure.Organizational change, workplace discrimination or major health issue often derails your career trajectory. A panel of technical women will share strategies to help prepare and position you for these challenges.	N
TM132: A Balancing Act: How to Define Your Priorities and Be Your Most Productive Self	Friday, October 4, 2019 9:00 AM	Friday, October 4, 2019 9:45 AM	UTC-4	OCCC W202B	Audience Level: All | Track: Tech Meetups | Focus Area: General Topics | Start Date: Friday, October 4, 2019 | Start Time: 9:00 AM | End Time: 9:45 AM | Location: OCCC W202B | Speakers: Sheila Oh	Are you consistently exhausted at the end of the week? Never have enough time to run errands or meet with friends? If so, you may be too busy. Or it's possible that you just haven't found the right balance.Join this tech meetup and learn how to reach your goals, prioritize your well-being, find balance both at home and work, and discover strategies to be your happiest and most productive self.	N
Faculty Lounge	Friday, October 4, 2019 9:00 AM	Friday, October 4, 2019 2:00 PM	UTC-4	OCCC W209B	Audience Level: Faculty | Track: Lounge | Start Date: Friday, October 4, 2019 | Start Time: 9:00 AM | End Time: 2:00 PM | Location: OCCC W209B	The Faculty Lounge is a place for faculty and academic staff to informally network, catch up on work, and grab a snack or drink. The Faculty Lounge will be open throughout the conference where faculty and any other attendees with an Academic registration can come relax and take a break.	N
Membership Special Lounge (Inaugural Offer)	Friday, October 4, 2019 9:00 AM	Friday, October 4, 2019 2:00 PM	UTC-4	OCCC W306A	Audience Level: Invite Only | Track: Lounge | Start Date: Friday, October 4, 2019 | Start Time: 9:00 AM | End Time: 2:00 PM | Location: OCCC W306A	"An exclusive lounge space that provides a premium experience for members of the AnitaB.org Membership Program. It is a comfortable place to ""camp out"" between sessions and meet people; and also a compelling reason for Grace Hopper Conference attendees to immediately join AnitaB.org Membership Program."	N
Student Lounge	Friday, October 4, 2019 9:00 AM	Friday, October 4, 2019 2:00 PM	UTC-4	OCCC W221C	Audience Level: Student | Track: Lounge | Start Date: Friday, October 4, 2019 | Start Time: 9:00 AM | End Time: 2:00 PM | Location: OCCC W221C	"The Student Lounge is a fun, interactive space where students can gather between sessions. The space will feature comfortable seating and student-focused amenities. The Student Lounge will be open throughout the conference for students to convene, mingle, and relax. They may stop by anytime they like.

Sponsored by Amazon and Western Digital"	N
DS717: Prototype to Production: How to Scale your Deep Learning Model	Friday, October 4, 2019 9:00 AM	Friday, October 4, 2019 10:00 AM	UTC-4	OCCC WF4	Audience Level: Advanced | Track: Data Science | Focus Area: Novel Applications, Use Cases, and Lessons Learned | Start Date: Friday, October 4, 2019 | Start Time: 9:00 AM | End Time: 10:00 AM | Location: OCCC WF4 | Speakers: Swetha Mandava, Alex Qi	With increasingly complex Deep Learning models and datasets, AI practitioners are faced with escalating training times, and hence lower productivity. In thisinteractive hands-on workshop, we will scale a prototype to production quality in 60 minutes. Starting with a popular recommender system* we will explore techniques to drastically improve performance and reduce training time by about 35x	N
Driving 5050 by 2025 Alliance Meeting (Invite Only)	Friday, October 4, 2019 9:00 AM	Friday, October 4, 2019 12:00 PM	UTC-4	Rosen Centre Salon 1	Audience Level: Invite Only | Track: Invite Only | Start Date: Friday, October 4, 2019 | Start Time: 9:00 AM | End Time: 12:00 PM | Location: Rosen Centre Salon 1	Achieving intersectional parity in tech is no small task and will require a coordinated effort across organizations and sectors. This invite-only meeting will provide insight into the 5050 by 2025 strategy and efforts of AnitaB.org.	N
Abie Award Series: Journey of an Outsider - From Newly-Minted PhD to Associate Professor	Friday, October 4, 2019 9:00 AM	Friday, October 4, 2019 10:00 AM	UTC-4	OCCC W300	Track: Abie Award Series | Start Date: Friday, October 4, 2019 | Start Time: 9:00 AM | End Time: 10:00 AM | Location: OCCC W300 | Speakers: Thamar Solorio	Thamar candidly discusses her experience with faculty job search as a researcher with undergrad & grad education from Mexico. She shares high & lows of a 15 year career in the US, including receiving a CAREER award from the NSF and the Emerging Leader Abie Award. Topics include having children on tenure track, switching jobs & restarting a research program, serving as chair for a major conference.	N
