ID	[ADD CALENDAR ID HERE]
Name	StartTime	EndTime	TimeZone	Location	Description	MoreDetails	IsScheduled
Aspiring Technologists GHC Bootcamp (Invite Only)	Tuesday, October 1, 2019 11:00 AM	Tuesday, October 1, 2019 3:00 PM	UTC-4	OCCC W230C	Audience Level: Invite Only | Track: Invite Only | Start Date: Tuesday, October 1, 2019 | Start Time: 11:00 AM | End Time: 3:00 PM | Location: OCCC W230C	AnitaB.org is supporting alumnae from girl-in-tech programs in attending GHC 19 for the first time. Navigating GHC can be a daunting task, so AnitaB.org is conducting the Aspiring Technologists Bootcamp; a special program designed to help this group of young women connect, build a plan for getting the most out of GHC programming, and prepare for the next steps of their career journey.	N
First Timer's Orientation	Tuesday, October 1, 2019 3:30 PM	Tuesday, October 1, 2019 4:30 PM	UTC-4	OCCC Chapin Theater (Lvl 3)	Audience Level: All | Track: Featured Session | Start Date: Tuesday, October 1, 2019 | Start Time: 3:30 PM | End Time: 4:30 PM | Location: OCCC Chapin Theater (Lvl 3) | Speakers: Beth Roberts, Stuti Badoni, Tamera Tolbert, Crystal Cooper, Mitzi Iniguez	Come learn about all of the exciting opportunities available at GHC 19. Hear from organizers of the event and learn tips and tricks to get the most out of your time.	N
Session Chair Orientation (Invite Only)	Tuesday, October 1, 2019 4:00 PM	Tuesday, October 1, 2019 5:00 PM	UTC-4	OCCC W300	Audience Level: Invite Only | Track: Invite Only | Start Date: Tuesday, October 1, 2019 | Start Time: 4:00 PM | End Time: 5:00 PM | Location: OCCC W300	If you've been selected to serve as a session chair, thank you! Come for a brief overview of duties, rules for speakers and reporting expectations. Bring your questions and we will be ready with answers.	N
Career Fair Hall Crawl	Tuesday, October 1, 2019 5:00 PM	Tuesday, October 1, 2019 6:30 PM	UTC-4	OCCC Hall WA4/WB1	Audience Level: All | Start Date: Tuesday, October 1, 2019 | Start Time: 5:00 PM | End Time: 6:30 PM | Location: OCCC Hall WA4/WB1	"The Career Fair Hall Crawl offers you the chance to check out the Career Fair and Technology Showcase before things get into full swing. Mingle while enjoying beverages & snacks, or purchase limited edition GHC 19 swag. Visit the AnitaB.org booth to meet AnitaB.org staff and Local community members. The Career Fair Hall Crawl takes place on Tuesday, October 1, 5–6:30 p.m. 

No need to add this to your agenda, but badges are required."	N
Aspiring Technologist and Community Cohort Networking Reception (Invite Only)	Tuesday, October 1, 2019 6:30 PM	Tuesday, October 1, 2019 9:00 PM	UTC-4	Rosen Centre Grand Ballroom A	Audience Level: Invite Only | Track: Invite Only | Start Date: Tuesday, October 1, 2019 | Start Time: 6:30 PM | End Time: 9:00 PM | Location: Rosen Centre Grand Ballroom A	AnitaB.org is excited to welcome women from the Aspiring Technologist and Community Cohorts to GHC 19. This group of women represent the future of tech, and this invite-only networking reception will provide them with an opportunity to build relationships with one another in a relaxed, fun environment featuring food, music, and games.	N
Speakers' Reception (Invite Only)	Tuesday, October 1, 2019 7:00 PM	Tuesday, October 1, 2019 8:30 PM	UTC-4	Hyatt Windermere Ballroom X	Audience Level: Invite Only | Track: Invite Only | Start Date: Tuesday, October 1, 2019 | Start Time: 7:00 PM | End Time: 8:30 PM | Location: Hyatt Windermere Ballroom X	Accepted speakers are invited to join us for an evening reception to meet the GHC Programs Team, our track chairs, and network with other speakers and reception sponsors. Advanced RSVP is required.	N
Hoppers Orientation (invite only)	Tuesday, October 1, 2019 7:00 PM	Tuesday, October 1, 2019 8:00 PM	UTC-4	OCCC W222B	Audience Level: Invite Only | Track: Invite Only | Start Date: Tuesday, October 1, 2019 | Start Time: 7:00 PM | End Time: 8:00 PM | Location: OCCC W222B	Hoppers will meet other Hoppers, hear about their assignments and learn the rules they must follow while fulfilling their duties. They will also receive their Hopper t-shirt. This session is required for all Hoppers.	N
Community Blogger/ Notetaker/ Mentor Volunteer Orientation	Wednesday, October 2, 2019 6:45 AM	Wednesday, October 2, 2019 8:00 AM	UTC-4	OCCC WF2	Track: Communities | Start Date: Wednesday, October 2, 2019 | Start Time: 6:45 AM | End Time: 8:00 AM | Location: OCCC WF2	"The Anita|Bees committee manages our volunteers for Speed Mentoring and Bloggers and Notetakers. This session is an ""Ask Me Anything"" to answer any questions volunteers may have, and a ""What You Need to Know"" to be set up for success as a volunteer. We will be offering coffee and breakfast to get our volunteers ready for a day of documenting this exciting Celebration of Women Technologists."	N
Hoppers Lounge	Wednesday, October 2, 2019 8:00 AM	Wednesday, October 2, 2019 6:00 PM	UTC-4	OCCC W209C	Audience Level: Invite Only | Track: Lounge | Start Date: Wednesday, October 2, 2019 | Start Time: 8:00 AM | End Time: 6:00 PM | Location: OCCC W209C	The Hoppers Lounge is a room where Hoppers only can take breaks, and chat with other Hoppers.	N
Wednesday Keynote: Aicha Evans and Ana Roca Castro	Wednesday, October 2, 2019 9:00 AM	Wednesday, October 2, 2019 10:45 AM	UTC-4	OCCC Hall WA3	Audience Level: All | Track: General Session | Start Date: Wednesday, October 2, 2019 | Start Time: 9:00 AM | End Time: 10:45 AM | Location: OCCC Hall WA3 | Speakers: Natalya Bailey, Jhillika Kumar, Fei-Fei Li, Aicha Evans, Ana Roca Castro, Brenda Darden Wilkerson	"Developing the future of autonomous mobility with fully autonomous electric vehicles…

Igniting the genius in every child using technology to bring the best quality education to communities around the world, especially the most underserved…

Democratizing AI, pioneering future technological innovations, and advocating diversity in STEM and AI internationally…

Inventing a new form of propulsion engine that made use of a liquid ion propulsion technology for small satellites that is safer to handle, cheaper to produce, and smaller in terms of mass and volume…

We will change the world.  Come hear amazing women leaders, innovators and thought leaders at the GHC 19 Opening Keynote!"	N
AZ573: Design It: Bring Forth the Innovation	Wednesday, October 2, 2019 11:30 AM	Wednesday, October 2, 2019 12:30 PM	UTC-4	OCCC W414A	Audience Level: Beginning | Track: Products A to Z | Focus Area: Conceptualization | Start Date: Wednesday, October 2, 2019 | Start Time: 11:30 AM | End Time: 12:30 PM | Location: OCCC W414A | Speakers: Katherine Kahla	This workshop will broaden the audience's ability to develop ideas and transform them into a viable solution. This process of design thinking is applicable to all capabilities and situations that are in need of teamwork, collaboration, and new ways of thinking.	N
AI607: Role of Computer Vision in Revolutionizing Computer-Assisted Surgery	Wednesday, October 2, 2019 11:30 AM	Wednesday, October 2, 2019 12:00 PM	UTC-4	OCCC W304C	Audience Level: Intermediate | Track: Artificial Intelligence | Focus Area: AI Applications | Start Date: Wednesday, October 2, 2019 | Start Time: 11:30 AM | End Time: 12:00 PM | Location: OCCC W304C | Speakers: Niveditha Kalavakonda	Computer-assisted surgery has evolved with the advancing technology to augment a surgeon's ability to administer surgical procedures. It assists in decreasing the invasiveness of surgical procedures and improving safety and accuracy. This talk will provide an overview of the work in computer vision and surgical robotics that the author and her colleagues have done in CAS at the BioRobotics Lab.	N
SE670: Microservice Architecture: Orchestration to Reactive Approach	Wednesday, October 2, 2019 11:30 AM	Wednesday, October 2, 2019 12:00 PM	UTC-4	OCCC W224D	Audience Level: Intermediate | Track: Software Engineering | Focus Area: Architecture and Design of Large-Scale Software | Start Date: Wednesday, October 2, 2019 | Start Time: 11:30 AM | End Time: 12:00 PM | Location: OCCC W224D | Speakers: Divya Goel, Chandni Jain	"""Microservices are something you grow into, not begin with."" In this presentation we will discuss orchestration, reactive and hybrid approach to the microservice paradigm. We will dive into how we applied these to Walmart's catalog serving millions of items."	N
CR311: The Future is Now, Let's Retain Women in Tech	Wednesday, October 2, 2019 11:30 AM	Wednesday, October 2, 2019 12:00 PM	UTC-4	Hyatt Regency Ballroom S	Audience Level: Mid-Career | Track: Career | Focus Area: Inclusion and Cultural Awareness | Start Date: Wednesday, October 2, 2019 | Start Time: 11:30 AM | End Time: 12:00 PM | Location: Hyatt Regency Ballroom S | Speakers: Jossie Haines	After burning out and leaving the tech industry in early 2018, Jossie Haines had a revelation and had to come back and start a mission to keep women in tech.  The future is now, yet we aren't there to influence it.  Come learn why resilience, a good boss and sponsor and environment are key to keeping women in tech.  Feel empowered to be brave and find an environment where you can thrive.	N
OT304: Action Steps for Change: Ways To Create A Diverse Workforce at Every Level	Wednesday, October 2, 2019 11:30 AM	Wednesday, October 2, 2019 12:30 PM	UTC-4	Hyatt Regency Ballroom Q	Audience Level: Mid-Career | Track: Organizational Transformation | Focus Area: Channeling Insights into Culture Change | Start Date: Wednesday, October 2, 2019 | Start Time: 11:30 AM | End Time: 12:30 PM | Location: Hyatt Regency Ballroom Q | Speakers: Anne Cocquyt, Patty Dingle, Tamara Mendelsohn, Shu-Yi Zhou, Cara Shortsleeve	Three industry leaders share their experiences leading gender equality initiatives at technology companies. Audience members will learn three ways to create a diverse culture via examples in hiring practices, programs for advancement, and ERGs so that they can foster inclusivity at their own companies. Discussion includes data on the gender gap from LinkedIn & the 2019 Women in Product survey.	N
DS564: Designing Data Visuals That Sparkle: Building Insight You Can See	Wednesday, October 2, 2019 11:30 AM	Wednesday, October 2, 2019 12:30 PM	UTC-4	OCCC W415B	Audience Level: Beginning | Track: Data Science | Focus Area: Novel Applications, Use Cases, and Lessons Learned | Start Date: Wednesday, October 2, 2019 | Start Time: 11:30 AM | End Time: 12:30 PM | Location: OCCC W415B | Speakers: Amber Hoak, Kate Lytvynets, David Tittsworth	Do you deal with data but struggle to create data visuals that tell a story? Data visuals create impact and insight, particularly with big data. D3.js is a powerful open source SVG drawing library that empowers you to design complex visuals. Learn core concepts of SVG, binding data, adding animation sparkle, and optimization tips. Walk away with your own interactive, compelling data visual.	N
CR134: How to Confront Sexists, Racists and Other Offenders Like a Boss	Wednesday, October 2, 2019 11:30 AM	Wednesday, October 2, 2019 12:30 PM	UTC-4	Hyatt Orlando Ballroom L	Audience Level: All | Track: Career | Focus Area: Inclusion and Cultural Awareness | Start Date: Wednesday, October 2, 2019 | Start Time: 11:30 AM | End Time: 12:30 PM | Location: Hyatt Orlando Ballroom L | Speakers: Jennifer Plummer, Marie Mendoza	Ever had someone say something offensive to you that rendered you speechless? Were you worried your response would be too emotional? Would you rather HR speak up for you? Did you think of the perfect response hours later? This workshop provides guidelines on how to professionally respond to offensive comments and allows practice through role play so you will not be caught off guard in the future.	N
CR201: I’m a Student Again: Heading to Graduate School after a Break	Wednesday, October 2, 2019 11:30 AM	Wednesday, October 2, 2019 12:30 PM	UTC-4	OCCC W307D	Audience Level: All | Track: CRA-W | Start Date: Wednesday, October 2, 2019 | Start Time: 11:30 AM | End Time: 12:30 PM | Location: OCCC W307D | Speakers: Anna Gommerstadt, India Irish	Considering graduate school after some time working? Already back in school? This session will cover how to position yourself to apply to graduate school, the differences between professional masters and Ph.D. programs, and tips for being successful in graduate school. We’ll have plenty of time for questions, so bring yours.	N
Professional Development Leadership Workshop: Leaders & Followers & Team Mates Oh My!	Wednesday, October 2, 2019 11:30 AM	Wednesday, October 2, 2019 1:30 PM	UTC-4	Hyatt Windermere Z	Audience Level: All | Track: Special Session | Start Date: Wednesday, October 2, 2019 | Start Time: 11:30 AM | End Time: 1:30 PM | Location: Hyatt Windermere Z | Speakers: Denise Brosseau	Throughout our career, we are asked to be leaders; of ourselves, of teams, in communities and of organizations. In this experiential workshop, we’ll explore frameworks of leadership, followership and teamwork; uncover what holds us back from being more effective in each of these roles; and create a plan for how to shift our mindset and develop skillsets of great leaders, team mates and followers.	N
HW522: Why Hardware is Hard: The Google Home Sound	Wednesday, October 2, 2019 11:30 AM	Wednesday, October 2, 2019 12:00 PM	UTC-4	OCCC W312C	Audience Level: Beginning | Track: Hardware | Focus Area: Makers and Hardware Outside the CPU | Start Date: Wednesday, October 2, 2019 | Start Time: 11:30 AM | End Time: 12:00 PM | Location: OCCC W312C | Speakers: Frances Kwee, Indu Ancha	A behind-the-scenes look at Google's hardware design process to lead the smart home revolution. An in-depth look at multi-disciplinary challenges, key strategies and design choices during the first three generations of Google Home smart speakers to design an exceptional audio-first product. Lessons learned from the perspective of an acoustics engineer and a mechanical engineer.	N
Speaker Lounge	Wednesday, October 2, 2019 11:30 AM	Wednesday, October 2, 2019 5:30 PM	UTC-4	OCCC W305	Audience Level: Invite Only | Start Date: Wednesday, October 2, 2019 | Start Time: 11:30 AM | End Time: 5:30 PM | Location: OCCC W305	GHC speakers are invited to rest and recharge before and after their sessions. Another opportunity to network with other speakers or get some quiet time.	N
Faculty Lounge	Wednesday, October 2, 2019 11:30 AM	Wednesday, October 2, 2019 5:30 PM	UTC-4	OCCC W209B	Audience Level: Faculty | Track: Lounge | Start Date: Wednesday, October 2, 2019 | Start Time: 11:30 AM | End Time: 5:30 PM | Location: OCCC W209B	The Faculty Lounge is a place for faculty and academic staff to informally network, catch up on work, and grab a snack or drink. The Faculty Lounge will be open throughout the conference where faculty and any other attendees with an Academic registration can come relax and take a break.	N
Interview Hall	Wednesday, October 2, 2019 11:30 AM	Wednesday, October 2, 2019 5:30 PM	UTC-4	OCCC Hall WD2	Start Date: Wednesday, October 2, 2019 | Start Time: 11:30 AM | End Time: 5:30 PM | Location: OCCC Hall WD2	Have you scheduled an interview with one of our Sponsors? If the booth number that you will be interviewing in is numbered between 3000 - 5500 you will want to arrive with enough time to pass badge security and to find your interview location.	N
GHC Career Fair and Technology Showcase	Wednesday, October 2, 2019 11:30 AM	Wednesday, October 2, 2019 5:30 PM	UTC-4	OCCC Hall WA4/WB1	Audience Level: All | Start Date: Wednesday, October 2, 2019 | Start Time: 11:30 AM | End Time: 5:30 PM | Location: OCCC Hall WA4/WB1	"GHC Expo is one of the most highly attended functions. It serve as an influential platform for companies, academics, governments, and industry experts to come together, share and learn information, hire qualified talents, network and build business relationships among women technologists. GHC Expo has hundreds of career fair and interview booths including poster sessions and Technology Showcase. 

Badges are required to enter the Expo Halls."	N
Senior Leadership Summit- Professional Development Track (Invite Only)	Wednesday, October 2, 2019 11:30 AM	Wednesday, October 2, 2019 5:30 PM	UTC-4	Rosen Centre Grand Ballroom C	Audience Level: Invite Only | Track: Invite Only | Start Date: Wednesday, October 2, 2019 | Start Time: 11:30 AM | End Time: 5:30 PM | Location: Rosen Centre Grand Ballroom C | Speakers: Jamika D Burge, Sukhinder Singh Cassidy, Selena Rezvani, Dolly Singh, Tamar Lucien, Lisa Gelobter, Jeni Panhorst, Tammy Sun, Cadran Cowansage, Dominique Hollins	The Professional Development Track of the Senior Leadership Summit (formally Senior Women's Program) is an invite only session for senior level career women who want to explore their leadership strategy and lead with greater effectiveness by delving into challenges faced at the highest levels of leadership. Attendees will build on core leadership skills and strengths to achieve peak performance.	N
Speakers Corner	Wednesday, October 2, 2019 11:30 AM	Wednesday, October 2, 2019 5:30 PM	UTC-4	AnitaB.org Booth (631)	Start Date: Wednesday, October 2, 2019 | Start Time: 11:30 AM | End Time: 5:30 PM | Location: AnitaB.org Booth (631) | Speakers: Kesha Williams, Jessica Naziri, Natalya Bailey, Tal Rabin, Laura Haas, Erin MacLeod, Ana Roca Castro	Your Chance to Meet the Speakers!Stop by the AnitaB.org Booth #631 at the top of the hour to catch your favorite speakers in the Speakers Corner Theater. You’ll hear from ABIE Award winners, Keynote and Featured Speakers, and Academic and Tech Community Leaders in an intimate and informal setting.11:45 a.m. – 12:30 p.m. – Meet and Greet and Q&A with Keynote Speaker Ana Roca Castro1:00 p.m. – 1:45 p.m. - Abie Awards 15th Anniversary with Abie Award Winners Dr. Natalya Bailey, Tal Rabin, Camilla Achutti, and Laura Haas2:00 p.m. – 2:45 p.m. – Meet and Greet and Q&A with Featured Speaker Erin MacLeod3:00 p.m. – 3:45 p.m. – Meet and Greet with Featured Speaker Jessica Naziri4:00 p.m. – 4:45 p.m. – Increase Confidence and Visibility by Learning with Kesha Williams	N
Membership Special Lounge (Inaugural Offer)	Wednesday, October 2, 2019 11:30 AM	Wednesday, October 2, 2019 5:30 PM	UTC-4	OCCC W306A	Audience Level: Invite Only | Track: Lounge | Start Date: Wednesday, October 2, 2019 | Start Time: 11:30 AM | End Time: 5:30 PM | Location: OCCC W306A	"An exclusive lounge space that provides a premium experience for members of the AnitaB.org Membership Program. It is a comfortable place to ""camp out"" between sessions and meet people; and also a compelling reason for Grace Hopper Conference attendees to immediately join AnitaB.org Membership Program."	N
Mentoring Circles	Wednesday, October 2, 2019 11:30 AM	Wednesday, October 2, 2019 12:40 PM	UTC-4	OCCC WF2	Audience Level: All | Track: Mentoring Circles | Start Date: Wednesday, October 2, 2019 | Start Time: 11:30 AM | End Time: 12:40 PM | Location: OCCC WF2 | Speakers: Ayanna Howard, LaCinda Clem, Kathrin Nos, Kylie Taitano, Parul Seth, Wendy Lucas, Catherine Spence, Jaelle Scheuerman, Rachelle Helton, Gail Alverson, Kesha Williams, Stefanie Schmitt, Jennifer Xu, Susan Galbraith, Baerbel Haenelt, Salina Greenwalt, Vineetha Menon, Letha Etzkorn, Johanna Rusly, Jacquelyne Howard, Nikita Chhabria, Shailvi Wakhlu, Sofia Zaks, Kate Hanpachern, Katie Le, Lusen Mendel, Alicia Tang, Zhiling Wan, D'Yanna Craighead, Preeti Shekar, Dawn Wright, Alice Tian, Pooja Sund, Penelope Brooks, Ilisha Ramachandran, Alicia Jay White, Anita Rao, Steffi Dsouza, Margret Schmidt, Manisha Sule, Kanika Khosla, Chandrika Gokul, Diana Lovati, Hena Teinzer, Dagna Bieda, Samira Tasharofi, Annapurna Vadaparty, Neha Kulkarni, Kanika Sharma, Julia Kieserman, Sarah Mogin, Na'Kaila Sandidge, Jessica Kuhl, Ming Lin, Deb Agarwal, Susan Rodger, Rinki Sethi, Shelley Westman, Stephanie Ginos, Snehal Khandker, Yerika Jimenez, Maria Gini, Maria Jump, Bushra Anjum, Diane Woodbridge, Jeannie Albrecht, Sheila Castaneda, Nancy Amato	Before you meet with organizations in the Expo Hall, be sure to attend this interactive mentoring session, where you'll receive great tips on job searching, interviews, and furthering your career. Each of the 50 tables is hosted by a mentor focusing on a particular topic. Attendees choose a topic and chat with a mentor for 20 min. Every 20 min, attendees switch tables and chat with another mentor. Learn more about topics and speakers on our website.	N
SP669: Building Blocks of Security As A Service	Wednesday, October 2, 2019 11:30 AM	Wednesday, October 2, 2019 12:00 PM	UTC-4	OCCC WF3	Audience Level: Intermediate | Track: Security/Privacy | Focus Area: Security and Privacy Aspects of the Advanced CyberInfrastructure (CI) | Start Date: Wednesday, October 2, 2019 | Start Time: 11:30 AM | End Time: 12:00 PM | Location: OCCC WF3 | Speakers: Anjana Kambhampati	Trends like distributed endpoints, applications and data moving to the cloud are not only disrupting traditional workforce but are also increasing risks with increased attack surface and sophistication forcing organizations to outsource security. This talk will focus on the technical requirements needed to build products to enable providers and vendors to offer security as a service.	N
Student Lounge	Wednesday, October 2, 2019 11:30 AM	Wednesday, October 2, 2019 5:30 PM	UTC-4	OCCC W221C	Audience Level: Student | Track: Lounge | Start Date: Wednesday, October 2, 2019 | Start Time: 11:30 AM | End Time: 5:30 PM | Location: OCCC W221C	"The Student Lounge is a fun, interactive space where students can gather between sessions. The space will feature comfortable seating and student-focused amenities. The Student Lounge will be open throughout the conference for students to convene, mingle, and relax. They may stop by anytime they like.

Sponsored by Amazon and Western Digital"	N
IW532: Mirror, Mirror on the Dressing Room Wall, What Looks Good with This Dress?	Wednesday, October 2, 2019 11:30 AM	Wednesday, October 2, 2019 12:00 PM	UTC-4	OCCC W222B	Audience Level: Beginning | Track: Internet of Things/Wearable Tech | Start Date: Wednesday, October 2, 2019 | Start Time: 11:30 AM | End Time: 12:00 PM | Location: OCCC W222B | Speakers: Allison Youngdahl, Sunil Shettigar	E-commerce websites collect data on every click and purchase a customer makes, yet brick-and-mortar stores are relatively blind to what their customers are doing. We will present a way for retailers to visualize the customer journey through the store by creating a dressing room experience that receives customer feedback and improves product recommendations using IoT devices.	N
Communities Hall (Day 1)	Wednesday, October 2, 2019 11:30 AM	Wednesday, October 2, 2019 5:30 PM	UTC-4	Hyatt Florida Ballroom B	Audience Level: All | Track: Communities | Start Date: Wednesday, October 2, 2019 | Start Time: 11:30 AM | End Time: 5:30 PM | Location: Hyatt Florida Ballroom B	"Please join us in the Communities Hall to network, participate in professional development, collaborate with your peers, discuss future plans, and join a community of your choice. This dedicated space focuses on highlighting the skills, activities, accomplishments, and expertise of our Community Leader Volunteers and members of each community.  Come by to spend time with our Community Hall Sponsors: Discover, Google, FullStory, and Medidata. We are looking forward to facilitating connections, building relationships, and providing a greater opportunity to grow all AnitaB.org communities.Programming
11:30am – 12pm Networking ChaCha Slide12pm – 1pm Peer Resume Reviews 
1:30pm-2:30pm Interview Coaching 
3:00pm-4:00pm DIY Pay Equity 
4:00pm-5:30pm Lightening Tech Talks: What’s Your Why?  
Community Fair
11:30am-1:00pm Tokyo; Los Angeles; Silicon Valley; Iranian Women In Computing; Black Women In Computing; Latinas In Computing;
Pakistani Women In Computing1:30pm -3pm Nairobi; Chicago; Washington DC; Japanese Women In Computing; Indian Women In Computing; LGBTQA
In Computing; Worldwide Volunteers3:30pm – 5:00pm London; Dublin; Houston; Systers; Systers Spain 
Meetups/Socials1:30am-12:30pm Meetup/Social Celebrating Arab Women in Technical Roles
1pm-2pm Meetup/Social Celebrating Jewish and Kyrgyzstan Women in Technical Roles 
2:30pm-3:30pm Meetup/Social Celebrating Indian Women in Technical Roles 
4pm-5pm Meetup/Social Celebrating Chinese Women in Technical Roles"	N
Techniques for Photorealistic Realtime Gaming (on Intel Integrated Graphics)	Wednesday, October 2, 2019 12:00 PM	Wednesday, October 2, 2019 12:15 PM	UTC-4	Technology Showcase Theater, OCCC Expo Hall WB4	Start Date: Wednesday, October 2, 2019 | Start Time: 12:00 PM | End Time: 12:15 PM | Location: Technology Showcase Theater, OCCC Expo Hall WB4 | Speakers: Kelly Gawne	With the advent of stunning new technologies for real-time graphics, it's time we brought the benefits of these advances to users everywhere. From cinematic to gaming to the rise of VR and AR, real-time today is about shaping the landscape of the coming decades for collaborative, inclusive virtual experiences. Together we'll explore the state of real-time graphics through a new photorealistic demo that's built with Unreal Engine and showcases new techniques like variable rate shading.	N
