ID	[ADD CALENDAR ID HERE]
HW524: Have Your Pi and Share it Too: Using Low-cost Hardware to Promote STEM in Your Community	Wednesday, October 2, 2019 2:30 PM	Wednesday, October 2, 2019 3:00 PM	UTC-4	OCCC W312C	Audience Level: Beginning | Track: Hardware | Focus Area: Makers and Hardware Outside the CPU | Start Date: Wednesday, October 2, 2019 | Start Time: 2:30 PM | End Time: 3:00 PM | Location: OCCC W312C | Speakers: Jody LeBlanc, Christine Kuo	Raspberry Pis, Arduinos, and other gateway hardware provide technologists with inexpensive educational tools for teaching hardware and programming concepts. In this session you will learn how SAP is leveraging this low-cost technology to promote STEM in youth, and how hands-on workshops developed in partnership with community organizations make learning technology fun, creative, and engaging.	N
CS616: Getting More for Less - Hardware Compression in Storage Systems	Wednesday, October 2, 2019 2:45 PM	Wednesday, October 2, 2019 3:15 PM	UTC-4	OCCC W314A	Audience Level: Intermediate | Track: Computer Systems Engineering | Focus Area: Building Blocks for the Future of Computing | Start Date: Wednesday, October 2, 2019 | Start Time: 2:45 PM | End Time: 3:15 PM | Location: OCCC W314A | Speakers: Meeta Saggi	Compression is the cornerstone of data reduction in storage systems. It plays an integral role in lowering total cost of ownership and achieving overall performance targets. However, software compression comes with inherent costs. We explore why compression is important in flash-based storage systems, the tradeoffs involved, and how using custom FPGA hardware can alleviate the pain points.	N
CR408: Diversity Advocates: Launching a Tool to Increase Expertise & Efficacy Among Tech D&I Leaders	Wednesday, October 2, 2019 2:45 PM	Wednesday, October 2, 2019 3:15 PM	UTC-4	Hyatt Regency Ballroom S	Audience Level: Senior/Executive | Track: Career | Focus Area: Inclusion and Cultural Awareness | Start Date: Wednesday, October 2, 2019 | Start Time: 2:45 PM | End Time: 3:15 PM | Location: Hyatt Regency Ballroom S | Speakers: Allison Scott, Cynthia Overton	Can Diversity Advocates improve tech diversity? In response to racial and gender disparities, tech companies have implemented numerous interventions with minimal gains. This session highlights the launch of a tech platform to support 1,000+ tech diversity leaders, by providing resources, professional education and community-building to increase the expertise and efficacy of D&I leaders in tech.	N
TW557: Innovations for Women in Developing Nations	Wednesday, October 2, 2019 2:45 PM	Wednesday, October 2, 2019 3:15 PM	UTC-4	OCCC W415D	Audience Level: Beginning | Track: Tech for Women | Focus Area: Non-profits & Mission-driven initiatives | Start Date: Wednesday, October 2, 2019 | Start Time: 2:45 PM | End Time: 3:15 PM | Location: OCCC W415D | Speakers: Akriti Gupta, Gloria Wee	To ensure upliftment for women is inclusive, we need to focus on emerging markets that are marked by  poverty, sexism, classism, lack of education and inadequate access to healthcare. Scarcity fuels innovation and technology allows us access to education and advancement. We want to showcase examples to illustrate innovations in developing markets that have driven meaningful change for women	N
VR715: AR / VR Scientific Visualization: Melding Computer Science and Artistic Design Theory	Wednesday, October 2, 2019 2:45 PM	Wednesday, October 2, 2019 3:15 PM	UTC-4	OCCC W415A	Audience Level: Advanced | Track: Virtual, Augmented, and Mixed Reality | Focus Area: The Future Impact of Immersive Technologies, Applications of Immersive Technologies | Start Date: Wednesday, October 2, 2019 | Start Time: 2:45 PM | End Time: 3:15 PM | Location: OCCC W415A | Speakers: Francesca Samsel	Sculpting Vis is a project developing methods for applying artistic voices to environmental data to create engaging intuitive immersive visualization experiences.  We will be presenting the work of our collaborative team of computer scientists, a visual artists and climate modeling scientists and how they worked together to develop a means of presenting complex science via an artistic language.	N
OS689: A Hitchhiker's Guide to the Open-Source Space	Wednesday, October 2, 2019 2:45 PM	Wednesday, October 2, 2019 3:45 PM	UTC-4	OCCC W230C	Audience Level: Intermediate | Track: Open Source | Start Date: Wednesday, October 2, 2019 | Start Time: 2:45 PM | End Time: 3:45 PM | Location: OCCC W230C | Speakers: Roxana Gonzalez Burgos, Namrata Malarout, Alice Yepremyan	We often use Open Source projects, but working with and contributing back to one for the first time can be an intimidating process. We want our participants to learn how to take their first step. Our goal is to familiarize participants with the concept of an open source project, the process of identifying improvements or bugs in the project and how to contribute to it.	N
Abie Award Winner Dr. Fei-Fei Li: Toward Human-Centered Artificial Intelligence	Wednesday, October 2, 2019 3:00 PM	Wednesday, October 2, 2019 4:00 PM	UTC-4	OCCC Chapin Theater (Lvl 3)	Track: Featured Session | Start Date: Wednesday, October 2, 2019 | Start Time: 3:00 PM | End Time: 4:00 PM | Location: OCCC Chapin Theater (Lvl 3) | Speakers: Fei-Fei Li	I will share the journey I have taken as an AI technologist, through the fascinating science of developing AI algorithms toward promoting an interdisciplinary, all-inclusive approach for tomorrow’s AI. I'll share the history of AI through my own perspective, then discuss why it is a critical time to create a new way of seeing, developing and deploying AI – the human-centered AI framework.	N
DS636: Three Tips for Better Predictive Models	Wednesday, October 2, 2019 3:00 PM	Wednesday, October 2, 2019 3:30 PM	UTC-4	OCCC W315B	Audience Level: Intermediate | Track: Data Science | Focus Area: Novel Applications, Use Cases, and Lessons Learned | Start Date: Wednesday, October 2, 2019 | Start Time: 3:00 PM | End Time: 3:30 PM | Location: OCCC W315B | Speakers: Stephanie Yang	This talk contains three tips, typically not covered in data science or machine learning classes, on how to increase the effectiveness of predictive models. The three tips are: (1) optimize for the right metric, (2) invest in feature engineering, and (3) examine your data. These tips will be illustrated using examples drawn from location intelligence.	N
Fall 2019 Partner Meeting (Invite Only)	Wednesday, October 2, 2019 3:00 PM	Wednesday, October 2, 2019 5:00 PM	UTC-4	Rosen Centre Grand Ballroom A	Audience Level: Invite Only | Track: Invite Only | Start Date: Wednesday, October 2, 2019 | Start Time: 3:00 PM | End Time: 5:00 PM | Location: Rosen Centre Grand Ballroom A | Speakers: Brenda Darden Wilkerson, Jacqueline Bouvier Copeland, Robert Read, Mike McGee, Hayley Brown	The AnitaB.org team will update Partner companies on the progress we’ve made since the Spring 2019 Partner meeting. This GHC gathering will provide networking opportunities between Partner companies and help them understand how to best utilize the partnership to accomplish their DEI goals.	N
SP668: Secure Enough: Building Security Ethos Without Handcuffing the Business	Wednesday, October 2, 2019 3:00 PM	Wednesday, October 2, 2019 3:30 PM	UTC-4	OCCC WF3	Audience Level: Intermediate | Track: Security/Privacy | Focus Area: Security and Privacy Aspects of the Advanced CyberInfrastructure (CI) | Start Date: Wednesday, October 2, 2019 | Start Time: 3:00 PM | End Time: 3:30 PM | Location: OCCC WF3 | Speakers: Yolonda Smith	It's been said that 'perfect is the enemy of good' and nowhere is that truer than in product development. How do you know when your product is secure enough? The answer has little to do with technology and instead how security tradeoffs enhance or degrade the trust users place in your product. In this talk, we provide techniques to help evaluate whether your security is 'good enough'.	N
Speed Mentoring	Wednesday, October 2, 2019 3:00 PM	Wednesday, October 2, 2019 5:30 PM	UTC-4	OCCC WF1	Audience Level: All | Track: Career | Start Date: Wednesday, October 2, 2019 | Start Time: 3:00 PM | End Time: 5:30 PM | Location: OCCC WF1	Anita|Bees Speed Mentoring will feature groups of 3 mentees:1 mentor in addition to 1:1 Lightning Mentor Rounds (7 minutes long). The event will still feature several 15-minute rounds in which attendees are matched with industry professionals, academic professionals, and successful graduate students by career level and area of interest that follow the defined GHC Tracks.	N
TM560: Socially Engineered Cybersecurity Threats: The Role of Ethical Hackers in Prevention	Wednesday, October 2, 2019 3:00 PM	Wednesday, October 2, 2019 3:45 PM	UTC-4	OCCC W202B	Audience Level: Beginning | Track: Tech Meetups | Focus Area: Digital Transformation – Privacy and Security | Start Date: Wednesday, October 2, 2019 | Start Time: 3:00 PM | End Time: 3:45 PM | Location: OCCC W202B | Speakers: Lauren E. Provost	Social engineering is a mainstream methodology in cybercrime.  In this session, participants will discuss the role of ethical hackers and social engineering in preventing threats within cybersecurity ecosystems.  As a group, we will use Metasploit to create an example attack and discuss preventative measures from an ethical hacker's perspective in addressing socially engineered threats.	N
Information Session on AnitaB.org Membership Program	Wednesday, October 2, 2019 3:00 PM	Wednesday, October 2, 2019 4:00 PM	UTC-4	Hyatt Regency Ballroom Q	Audience Level: All | Track: Special Session | Start Date: Wednesday, October 2, 2019 | Start Time: 3:00 PM | End Time: 4:00 PM | Location: Hyatt Regency Ballroom Q	Help shape the future of membership in AnitaB.org at this interactive brainstorming session.  Complimentary membership for all attendees.	N
IW710: IoT Data processing with MQTT, Kafka  & AI/ML	Wednesday, October 2, 2019 3:00 PM	Wednesday, October 2, 2019 3:30 PM	UTC-4	OCCC W222B	Audience Level: Advanced | Track: Internet of Things/Wearable Tech | Start Date: Wednesday, October 2, 2019 | Start Time: 3:00 PM | End Time: 3:30 PM | Location: OCCC W222B | Speakers: Menka Goyal	The core value of IoT lies in the data generated by devices. MQTT, the most commonly used IoT protocol, has challenges in scaling & persisting data. Apache Kafka can help alleviate these issues. It offers massive data store, great scalability, and consumption in real-time. We'll see how we integrate MQTT, Kafka, and other analytics tools to build a robust IoT solution.	N
Poster Session 2: ACM Student Research Competition, Internet of Things, Networks	Wednesday, October 2, 2019 3:00 PM	Wednesday, October 2, 2019 5:30 PM	UTC-4	OCCC Hall WA4/WB1	Audience Level: All | Track: General Poster Session & ACM Student Research Competition | Start Date: Wednesday, October 2, 2019 | Start Time: 3:00 PM | End Time: 5:30 PM | Location: OCCC Hall WA4/WB1 | Speakers: Samia Tasnim, Aida Ghazizadeh, Rezvaneh Rezapour, Maryam Karimi, Niloofar Safi Samghabadi, Maryamossadat Aghili, Nasheen Nur, Niki Gitinabard, Shahrzad Keshavarz, Zhaochen Gu, Aishwarya Mandyam, Paria Esmatloo, Akshita Bhagia, Nwamaka Okafor, Alisa Gazizullina, Kimia Zaman, Andreea Alexandru, Ana Luisa Solórzano, Ridhi LNU, Phuong Ha, Anusha Munjuluri, Gabrielle Gurdin, Sarah Hendriksen, Mariem Boujelbene, Forest Sweeney, Uma Bhattacharyya, Jhillika Kumar, Merril Hunt-Paez	Come meet the ACM Student Research Competition’s participants during this first round of the competition, and see their posters. Also learn about the innovative technology the next generation is dreaming up on the following topics: Internet of Things, Networks. For more detailed information, visit our website.	N
Empowering Your Digital Universe (Western Digital)	Wednesday, October 2, 2019 3:00 PM	Wednesday, October 2, 2019 3:15 PM	UTC-4	Technology Showcase Theater, OCCC Expo Hall WB4	Start Date: Wednesday, October 2, 2019 | Start Time: 3:00 PM | End Time: 3:15 PM | Location: Technology Showcase Theater, OCCC Expo Hall WB4	We generate a lot of data in our everyday lives, whether consciously by creating content or unconsciously as a result of taking action. The future is a data-driven world, and that's why Western Digital continues to drive innovation in digital storage. Today's storage technology has moved beyond keeping files organized and backing up; it's about enabling you to control your data and knowing where it's going.	N
Academic Corner, Pt. 2 | BRAID Research: Updates from Year Four of Data Collection	Wednesday, October 2, 2019 3:00 PM	Wednesday, October 2, 2019 4:00 PM	UTC-4	OCCC W308D	Audience Level: All | Track: Special Session | Start Date: Wednesday, October 2, 2019 | Start Time: 3:00 PM | End Time: 4:00 PM | Location: OCCC W308D	BRAID is a national initiative to increase the representation of women and URM students in undergraduate computing. This session will focus on what the BRAID Research team has learned, sharing the latest results and discussing implications of findings for computing departments. Findings related to the progress BRAID schools have made in diversifying computing majors will be shared.	N
CR317: The Spectrum of Feedback: The Thematic Divide in Feedback to Women & How Openly Discuss Bias	Wednesday, October 2, 2019 3:15 PM	Wednesday, October 2, 2019 3:45 PM	UTC-4	Hyatt Plaza International Ballroom H	Audience Level: Mid-Career | Track: Career | Focus Area: Inclusion and Cultural Awareness | Start Date: Wednesday, October 2, 2019 | Start Time: 3:15 PM | End Time: 3:45 PM | Location: Hyatt Plaza International Ballroom H | Speakers: Christina Vallery, Danielle Smith	The truth about feedback and women is that women receive feedback that is more biased and less actionable than that given to men. Unfortunately, this feedback becomes increasingly unprofessional as you climb the career ladder and is a barrier to building the equitable and inclusive workplaces we need. It's time we had an open dialogue about (and real advice on) how to give women better feedback.	N
Abie Award Series: Advances in Cryptography and Cryptocurrencies	Wednesday, October 2, 2019 3:15 PM	Wednesday, October 2, 2019 4:15 PM	UTC-4	OCCC W300	Audience Level: All | Track: Abie Award Series | Start Date: Wednesday, October 2, 2019 | Start Time: 3:15 PM | End Time: 4:15 PM | Location: OCCC W300 | Speakers: Tal Rabin	Learn about the work of reknowned expert in cryptography and cyber security, 2014 Abie Award winner Dr. Tal Rabin. Previously leading the Cryptographic Research Group at IBM, she now heads research at Algorand Foundation and is ensuring strong, lasting support for blockchain innovation.	N
HI650: Alexa, What's My Bill? Case Study of Research for Voice Assistant Devices in Utilities Space	Wednesday, October 2, 2019 3:15 PM	Wednesday, October 2, 2019 3:45 PM	UTC-4	OCCC W304G	Audience Level: Intermediate | Track: Human Computer Interaction | Focus Area: Human Factors and Best Practices | Start Date: Wednesday, October 2, 2019 | Start Time: 3:15 PM | End Time: 3:45 PM | Location: OCCC W304G | Speakers: Rachel Banks, Haley Hendershot	According to Nielsen Norman Group, 46% of U.S. adults use voice assistant devices. With that large of a user pool, many companies are experimenting with ways to leverage this technology to reach their customers. But how are lasting features created for reactive technology? This presentation will cover a case study where generative research resulted in user-centered feature recommendations.	N
CR121: Make Some Room: An Innovative Approach to Unconscious Bias Training	Wednesday, October 2, 2019 3:15 PM	Wednesday, October 2, 2019 3:45 PM	UTC-4	Hyatt Regency Ballroom O	Audience Level: All | Track: Career | Focus Area: Inclusion and Cultural Awareness | Start Date: Wednesday, October 2, 2019 | Start Time: 3:15 PM | End Time: 3:45 PM | Location: Hyatt Regency Ballroom O | Speakers: Pavani Yalla, Kathryn Beane	Traditional unconscious bias training programs often fall short. Seeing an opportunity to marry story, space, and technology in pursuit of more heartening outcomes, we designed an immersive intervention. Audio stories from real employees and wearable technology turn an office into an interactive story-scape, where participants understand what bias feels like rather than simply learn about it.	N
AZ664: Bringing a Customer Mindset into the World of Machine Learning and Artificial Intelligence	Wednesday, October 2, 2019 3:15 PM	Wednesday, October 2, 2019 3:45 PM	UTC-4	OCCC W311F	Audience Level: Intermediate | Track: Products A to Z | Focus Area: Conceptualization | Start Date: Wednesday, October 2, 2019 | Start Time: 3:15 PM | End Time: 3:45 PM | Location: OCCC W311F | Speakers: Sonu Durgia	Traditional Machine learning, AI products have limited customer mindset during conceptualization of model which poses limitations on the desired outcome. In real world search 60% customers express search intent & 40% don't express clearly what they are looking for.(Walmart sample 6.4 B queries annually).To tackle such customer challenges we apply new approach of multi-objective optimization in ML.	N
SE551: Building a Service Delivery Infrastructure	Wednesday, October 2, 2019 3:30 PM	Wednesday, October 2, 2019 4:00 PM	UTC-4	OCCC W224D	Audience Level: Beginning | Track: Software Engineering | Focus Area: Architecture and Design of Large-Scale Software | Start Date: Wednesday, October 2, 2019 | Start Time: 3:30 PM | End Time: 4:00 PM | Location: OCCC W224D | Speakers: Paula Paul, Rosemary Wang	Resilient, scalable, secure, and automated infrastructure accelerates the delivery of business value from software.How can we build infrastructure that supports such mythical delivery? This session applies software engineering and agile techniques to build 'Delivery infrastructure' as a set of software products that serve the needs of software engineers and operations teams.	N
CR311: The Future is Now, Let's Retain Women in Tech (Repeat)	Wednesday, October 2, 2019 3:30 PM	Wednesday, October 2, 2019 4:00 PM	UTC-4	Hyatt Regency Ballroom R	Audience Level: Mid-Career | Track: Career | Focus Area: Inclusion and Cultural Awareness | Start Date: Wednesday, October 2, 2019 | Start Time: 3:30 PM | End Time: 4:00 PM | Location: Hyatt Regency Ballroom R | Speakers: Jossie Haines	After burning out and leaving the tech industry in early 2018, Jossie Haines had a revelation and had to come back and start a mission to keep women in tech.  The future is now, yet we aren't there to influence it.  Come learn why resilience, a good boss and sponsor and environment are key to keeping women in tech.  Feel empowered to be brave and find an environment where you can thrive.	N
AI615: 5G and Artificial Intelligence	Wednesday, October 2, 2019 3:30 PM	Wednesday, October 2, 2019 4:00 PM	UTC-4	OCCC W304C	Audience Level: Intermediate | Track: Artificial Intelligence | Focus Area: AI Applications | Start Date: Wednesday, October 2, 2019 | Start Time: 3:30 PM | End Time: 4:00 PM | Location: OCCC W304C | Speakers: Anne Lee	The world is abuzz in anticipation of 5G networks that promises to enable revolutionary new applications including autonomous vehicles, IoTs, remote surgery, possibly even holographic telephony, and much more.  To do so, mobile networks will become necessarily more complex, requiring AI to automate and optimize functions that are or have become humanly impossible to do manually.	N
The Future of Cruising Powered by Technology (Royal Carribean Cruises Ltd)	Wednesday, October 2, 2019 3:30 PM	Wednesday, October 2, 2019 3:45 PM	UTC-4	Technology Showcase Theater, OCCC Expo Hall WB4	Start Date: Wednesday, October 2, 2019 | Start Time: 3:30 PM | End Time: 3:45 PM | Location: Technology Showcase Theater, OCCC Expo Hall WB4	Getting guests “from car to bar” in 10 minutes or less using facial recognition. Learn how we’re disrupting traditional boarding and making it easier for guests to embark on their vacations.Improving guest experience by making data-driven decisions by getting access to data quicker, more easily, and at scale. Adding intuitive logic to applications to optimize the number of guests, in the optimal locations, that we sail with, all while ensuring our guests’ safety is the priority.	N
CR407: Empathy as a Service: Supporting Mental Health in the Tech Workplace	Wednesday, October 2, 2019 3:45 PM	Wednesday, October 2, 2019 4:15 PM	UTC-4	Hyatt Regency Ballroom S	Audience Level: Senior/Executive | Track: Career | Focus Area: Inclusion and Cultural Awareness | Start Date: Wednesday, October 2, 2019 | Start Time: 3:45 PM | End Time: 4:15 PM | Location: Hyatt Regency Ballroom S | Speakers: Nara Kasbergen	1 in 5 adults are living with a mental illness such as depression, bipolar, anxiety, or ADHD. Yet how accommodating and inclusive are tech workplaces for people with these disorders? This talk aims to help end the stigma surrounding mental health and discuss how we can all become better allies, highlighting the important work done by the non-profit organization Open Sourcing Mental Illness (OSMI).	N
CS708: Express Backbone: Facebook's Long-Haul Network	Wednesday, October 2, 2019 3:45 PM	Wednesday, October 2, 2019 4:15 PM	UTC-4	OCCC W314A	Audience Level: Advanced | Track: Computer Systems Engineering | Focus Area: Building Blocks for the Future of Computing | Start Date: Wednesday, October 2, 2019 | Start Time: 3:45 PM | End Time: 4:15 PM | Location: OCCC W314A | Speakers: Rafit Izhak Ratzin	Facebook data centers backbone serve few billion users. The backbone design faced some challenges: Growing demand, quality of service, over provisioning, operation in scale, slow convergence. These challenges lead to a holistic Software Define Network solution called Express Backbone. The talk will describe the design motivation, the topology, the architecture, the journey, and lessons learned.	N
VR680: Virtual Reality for Brain Surgeries: Enhancing Visuality & Improving Patient Outcomes	Wednesday, October 2, 2019 3:45 PM	Wednesday, October 2, 2019 4:15 PM	UTC-4	OCCC W415A	Audience Level: Intermediate | Track: Virtual, Augmented, and Mixed Reality | Focus Area: The Future Impact of Immersive Technologies, Applications of Immersive Technologies | Start Date: Wednesday, October 2, 2019 | Start Time: 3:45 PM | End Time: 4:15 PM | Location: OCCC W415A | Speakers: Prachi Shah	The surgical planning process for brain surgeries has been unaltered for decades. Surgeons are using images of 2D brains to plan 3D surgeries, PowerPoint to edit medical images, and a universal approach for brains of both two and sixty-five year old patients. We explore the use of Virtual Reality as a tool in planning brain surgeries, to enhance visuality and improve patient outcomes.	N
CR113: What It Takes To Be a Leader in Cyber Security	Wednesday, October 2, 2019 4:00 PM	Wednesday, October 2, 2019 5:00 PM	UTC-4	Hyatt Regency Ballroom V	Audience Level: All | Track: Career | Focus Area: The Future of Work | Start Date: Wednesday, October 2, 2019 | Start Time: 4:00 PM | End Time: 5:00 PM | Location: Hyatt Regency Ballroom V | Speakers: Priyam Biswas, Abhilasha Bhargav-Spantzel, Ambareen Siraj, Diane M. Janosek, Parnian Najafi	Participation of women in CyberSecurity workforce is very low. Our panel is well suited to diagnose the key reasons behind the gender gap in cybersecurity from both supply(academia) and demand(industry and government) perspective. In the light of impending challenges, our panel will identify key areas to improve in both the sectors to pave the way for the future women cyber security professionals.	N
DS629: Busting Bias in Machine Learning for Cancer Research	Wednesday, October 2, 2019 4:00 PM	Wednesday, October 2, 2019 4:30 PM	UTC-4	OCCC W315B	Audience Level: Intermediate | Track: Data Science | Focus Area: Novel Applications, Use Cases, and Lessons Learned | Start Date: Wednesday, October 2, 2019 | Start Time: 4:00 PM | End Time: 4:30 PM | Location: OCCC W315B | Speakers: Lucy He	When machine learning (ML) techniques are applied to electronic medical records (EMRs) for research, studies can be larger or done faster than non-automated studies on EMR data. However, using ML may add clinical bias into the data extracted from EMRs. In this session, we will present how to limit such bias, which enables ML to be used in high-stakes research areas like cancer.	N
CR301: To Speak or Not to Speak about Stages of Physiological Shifts: Wellness, Womanhood, & -Pause	Wednesday, October 2, 2019 4:00 PM	Wednesday, October 2, 2019 5:00 PM	UTC-4	Hyatt Plaza International Ballroom G	Audience Level: Mid-Career | Track: Career | Focus Area: Inclusion and Cultural Awareness | Start Date: Wednesday, October 2, 2019 | Start Time: 4:00 PM | End Time: 5:00 PM | Location: Hyatt Plaza International Ballroom G | Speakers: Ritu Arora, Lani Fraizer, Deb Tates Gates, Kat Andrews, Helen Easterling Williams	Due to hormonal changes, women undergo natural stages of physiological shifts that can be detrimental to their career performance. Some women even fear risk of discrimination at workplace and suffer in silence due to symptoms. Let us discuss the impact of these physiological shifts -  especially, perimenopause and menopause - on career, and find strategies to confidently manage health with career.	N
